ID;Nama;NoHP;NoKTP;Alamat;Gender
P001;Andi Saputra;081234567801;3201123456780001;Jl. Melati No.12, Jakarta;L
P002;Rapip Ganteng;081234567890;3201123456780002;Jl. Tegal Parang Selatan V No.43, Jakarta;L
P003;Halim Santoso;081234567802;3201123456780003;Jl. Anggrek No.5, Bandung;L
P004;Laila Azzahra;081234567803;3201123456780004;Jl. Ujang Harapan No.21, Depok;P
P005;Rafi Ahmad;081234567804;3201123456780005;Jl. Kebon Jeruk No.17, Jakarta;L
P006;Satria Hidayat;081234567805;3201123456780006;Jl. Mawar No.3, Bekasi;L
P007;Falah Putri;081234567806;3201123456780007;Jl. Kenanga No.8, Bogor;P
P008;Agus Salim;081234567807;3201123456780008;Jl. Cemara No.10, Tangerang;L
